#,Menu_Item,SKU,Location,Category,Ingredients,Description,Price,Image,Order Online
1,Grilled Chicken Bánh M,BM02,Orillia,BANH MI,,"Juicy grilled chicken on a fresh baguette with house butter spread, crunchy cabbage, Vietnamese daikon and carrot pickles, lettuce, cucumber, pâté, cilantro, and mayo. A perfect blend of flavors in every bit",$12.00 ,https://d2s742iet3d3t1.cloudfront.net/restaurants/restaurant-239219000000000000/menu/items/7/item-1300000000044371577_1729591539.jpg?size=medium,https://order.toasttab.com/online/toronto-pho-orillia/item-grilled-chicken-bnh-m_b185df68-efd6-4e2c-9191-e42ae82f8d6e
2,Grilled Beef Bánh M,BM01,Orillia,BANH MI,,"Tender grilled beef on a fresh baguette with house butter spread, crunchy cabbage, Vietnamese daikon and carrot pickles, lettuce, cucumber, pâté, cilantro, and may",$12.00 ,https://d2s742iet3d3t1.cloudfront.net/restaurants/restaurant-239219000000000000/menu/items/5/item-1300000000044371575_1729591443.jpg?size=medium,https://order.toasttab.com/online/toronto-pho-orillia/item-grilled-beef-bnh-m_6785117e-4b1c-4854-8bbc-227fb89bdb37
3,Grilled Pork Bánh M,BM03,Orillia,BANH MI,,"Succulent Grilled Pork on a fresh baguette with house butter spread, crunchy cabbage, Vietnamese daikon and carrot pickles, lettuce, cucumber, pâté, cilantro, and mayo. A perfect blend of flavors in every bit",$12.00 ,https://d2s742iet3d3t1.cloudfront.net/restaurants/restaurant-239219000000000000/menu/items/9/item-1300000000044371579_1729591664.jpg?size=medium,https://order.toasttab.com/online/toronto-pho-orillia/item-grilled-pork-bnh-m_3825d4db-65ef-4a8c-a43d-51022482955e
4,Grilled Shrimp in Bao Bun,BB04,Orillia,BAO BUN,,"Grilled shrimp, crisp lettuce, crunchy cabbage, and tangy Vietnamese daikon carrot pickles, all layered with creamy house butter and mayo, tucked into a perfectly fried bao bun—crispy on the outside, soft and fluffy insid",$14.00 ,https://d2s742iet3d3t1.cloudfront.net/restaurants/restaurant-239219000000000000/menu/items/2/item-1300000000044368522_1729592332.jpg?size=medium,https://order.toasttab.com/online/toronto-pho-orillia/item-grilled-shrimp-in-bao-bun_5b1dfca2-e075-4961-9375-321ef09b6199
5,Grilled Beef in Bao Bun,BB02,Orillia,BAO BUN,,"Marinated grilled beef, crisp lettuce, crunchy cabbage, and tangy Vietnamese daikon carrot pickles, all layered with creamy house butter and mayo, tucked into a perfectly fried bao bun—crispy on the outside, soft and fluffy insid",$13.00 ,https://d2s742iet3d3t1.cloudfront.net/restaurants/restaurant-239219000000000000/menu/items/8/item-1300000000044368518_1729592226.jpg?size=medium,https://order.toasttab.com/online/toronto-pho-orillia/item-grilled-beef-in-bao-bun_4cb806f3-fc3d-44b2-ad8a-8fc28c23915c
6,Grilled Pork in Bao Bun,BB03,Orillia,BAO BUN,,"Grilled pork, crisp lettuce, crunchy cabbage, and tangy Vietnamese daikon carrot pickles, all layered with creamy house butter and mayo, tucked into a perfectly fried bao bun—crispy on the outside, soft and fluffy insid",$13.00 ,https://d2s742iet3d3t1.cloudfront.net/restaurants/restaurant-239219000000000000/menu/items/0/item-1300000000044368520_1729592282.jpg?size=medium,https://order.toasttab.com/online/toronto-pho-orillia/item-grilled-pork-in-bao-bun_52b90df2-c289-4368-9fee-6e5873313e46
7,Grilled Chicken in Bao Bun,BB01,Orillia,BAO BUN,,"Juicy grilled chicken, crisp lettuce, crunchy cabbage, and tangy Vietnamese daikon carrot pickles, all layered with creamy house butter and mayo, tucked into a perfectly fried bao bun—crispy on the outside, soft and fluffy insid",$13.00 ,https://d2s742iet3d3t1.cloudfront.net/restaurants/restaurant-239219000000000000/menu/items/6/item-1300000000044368516_1729592169.jpg?size=medium,https://order.toasttab.com/online/toronto-pho-orillia/item-grilled-chicken-in-bao-bun_6b66b483-69a8-409e-ad20-bc89fb268f6f
8,Well-Done Beef Pho,P03,Orillia,BEEF BROTH NOODLE - PHO,Rare beef/ Well-done beef/ Signature broth/ Savory spices/ Aromas/ Fresh rice noodles,"Tender rice noodles topped with well-done beef in a rich, aromatic beef broth. Served with hoisin, hot sauce, fresh herbs, bean sprouts, and lime for the ultimate comforting bowl.",$19.00 ,https://d2s742iet3d3t1.cloudfront.net/restaurants/restaurant-239219000000000000/menu/items/6/item-1300000000044373506_1729591229.jpg?size=medium,https://order.toasttab.com/online/toronto-pho-orillia/item-welldone-beef-pho_bf1f7dd6-a797-42fc-ba46-f9b8b5760d53
9,Rare Beef Pho,P02,Orillia,BEEF BROTH NOODLE - PHO,,"Tender rice noodles topped with rare beef in a rich, aromatic beef broth. Served with hoisin, hot sauce, fresh herbs, bean sprouts, and lime for the ultimate comforting bowl.",$19.00 ,https://d2s742iet3d3t1.cloudfront.net/restaurants/restaurant-239219000000000000/menu/items/4/item-1300000000044373504_1729591211.jpg?size=medium,https://order.toasttab.com/online/toronto-pho-orillia/item-rare-beef-pho_85e7a894-d0f5-43ae-88dd-f754b3c0914b
10,Flintstone Pho,,Orillia,BEEF BROTH NOODLE - PHO,,"A massive beef rib and tender well-done beef served over rice noodles in a rich, flavorful broth. Topped with fresh herbs, bean sprouts, lime, and served with hoisin and hot sauce. A hearty, satisfying meal for big appetites!",$25.00 ,https://d2s742iet3d3t1.cloudfront.net/restaurants/restaurant-239219000000000000/menu/items/8/item-1300000000044373508_1729591251.jpg?size=medium,https://order.toasttab.com/online/toronto-pho-orillia/item-flintstone-pho_bcfba6bf-8c89-495a-88d9-aa4063468577
11,Special HOT STONE bowl Noodle,,Orillia,BEEF BROTH NOODLE - PHO,,"Stone Bowl Pho with Beef Ribs: Hearty beef noodle soup served in a hot stone bowl with tender, flavorful beef ribs and fresh herbs in a rich, steaming broth",$39.00 ,https://d2s742iet3d3t1.cloudfront.net/restaurants/restaurant-239219000000000000/menu/items/0/item-1300000000044373520_1729591381.jpg?size=medium,https://order.toasttab.com/online/toronto-pho-orillia/item-special-hot-stone-bowl-noodle_c316dd7d-dd10-45a4-9a87-585fe3dedc10
12,Veggie Garden Pho,P02,Orillia,BEEF BROTH NOODLE - PHO,,"Low-simmered beef broth poured over tender rice noodles and fresh seasonal veggies. Served with hoisin, hot sauce, herbs, bean sprouts, and lime.",$19.00 ,https://d2s742iet3d3t1.cloudfront.net/restaurants/restaurant-239219000000000000/menu/items/0/item-1300000000044373510_1729591273.jpg?size=medium,https://order.toasttab.com/online/toronto-pho-orillia/item-veggie-garden-pho_70bf758b-218c-4601-b917-3e101aaf2325
13,Chicken Pho,P13,Orillia,BEEF BROTH NOODLE - PHO,,"ender slices of chicken served over rice noodles in a rich, aromatic beef broth. Comes with fresh herbs, bean sprouts, lime, hoisin, and hot sauce on the side for you to customize your perfect bowl.",$19.00 ,https://d2s742iet3d3t1.cloudfront.net/restaurants/restaurant-239219000000000000/menu/items/6/item-1300000000044373526_1729591463.jpg?size=medium,https://order.toasttab.com/online/toronto-pho-orillia/item-chicken-pho_6db664c5-adf7-4d9b-9d02-b9197fa5c0a1
14,Signature House Pho,P02,Orillia,BEEF BROTH NOODLE - PHO,,"Tender rice noodles topped with rare beef, well-done beef, tripe, beef balls, and tendon in a rich, aromatic beef broth. Served with hoisin, hot sauce, fresh herbs, bean sprouts, and lime for the ultimate comforting bowl.",$20.00 ,https://d2s742iet3d3t1.cloudfront.net/restaurants/restaurant-239219000000000000/menu/items/2/item-1300000000044373502_1729591072.jpg?size=medium,https://order.toasttab.com/online/toronto-pho-orillia/item-signature-house-pho_ad42d7df-a5be-496b-b822-c6dbf20859e3
15,Well Done Beef and Beef Meatball Pho,,Orillia,BEEF BROTH NOODLE - PHO,,"ender slices of Well Done Beef and savory meatballs served over rice noodles in a rich, aromatic broth. Comes with fresh herbs, bean sprouts, lime, hoisin, and hot sauce on the side for you to customize your perfect bowl.",$19.00 ,https://d2s742iet3d3t1.cloudfront.net/restaurants/restaurant-239219000000000000/menu/items/4/item-1300000000044373524_1729591448.jpg?size=medium,https://order.toasttab.com/online/toronto-pho-orillia/item-well-done-beef-and-beef-meatball-pho_b8ae4ad3-25a9-4dec-bf8d-b5371d2e5678
16,Shrimp Satay Pho,P07,Orillia,BEEF BROTH NOODLE - PHO,,"Aromatic experience with succulent shrimp in a creamy peanut-based broth. The broth is savory with a hint of sweetness, balanced by the nuttiness of the satay and a mild kick of spice",$21.00 ,https://d2s742iet3d3t1.cloudfront.net/restaurants/restaurant-239219000000000000/menu/items/4/item-1300000000044373514_1729591326.jpg?size=medium,https://order.toasttab.com/online/toronto-pho-orillia/item-shrimp-satay-pho_1e102e81-3ac2-456d-b011-64503b0b64ed
17,Blazing Beef Satay Pho Experience,P06,Orillia,BEEF BROTH NOODLE - PHO,,"A flavorful twist on the classic pho topped with tender rare beef, well-done beef, tripe, beef balls, and tendon in a rich, creamy peanut-based broth infused with aromatic.",$21.00 ,https://d2s742iet3d3t1.cloudfront.net/restaurants/restaurant-239219000000000000/menu/items/2/item-1300000000044373512_1729591293.jpg?size=medium,https://order.toasttab.com/online/toronto-pho-orillia/item-blazing-beef-satay-pho-experience_57ccc29f-73f8-4766-a9d4-043861d7ca96
18,Rare Beef and Beef Meatball Pho,P11,Orillia,BEEF BROTH NOODLE - PHO,,"ender slices of rare beef and savory meatballs served over rice noodles in a rich, aromatic broth. Comes with fresh herbs, bean sprouts, lime, hoisin, and hot sauce on the side for you to customize your perfect bowl.",$19.00 ,https://d2s742iet3d3t1.cloudfront.net/restaurants/restaurant-239219000000000000/menu/items/2/item-1300000000044373522_1729591429.jpg?size=medium,https://order.toasttab.com/online/toronto-pho-orillia/item-rare-beef-and-beef-meatball-pho_c31499f7-ef92-4991-b5a2-809cb9778fbc
19,Spicy Hue Fusion Vermicelli Noodle,P08,Orillia,BEEF BROTH NOODLE - PHO,,"Huế-style beef noodle soup with tender beef, pork hock, pork blood jelly and Vietnamese ham in a rich, fragrant broth of lemongrass and chili. Served with rice noodles and fresh herbs, it's a perfect balance of spicy, savory, and tangy flavo",$20.00 ,https://d2s742iet3d3t1.cloudfront.net/restaurants/restaurant-239219000000000000/menu/items/6/item-1300000000044373516_1729591346.jpg?size=medium,https://order.toasttab.com/online/toronto-pho-orillia/item-spicy-hue-fusion-vermicelli-noodle_c64b159c-25b9-44c8-bb48-7e5e6fc1f4ae
20,Hue Fire: Beef Rib Edition,,Orillia,BEEF BROTH NOODLE - PHO,,"Spicy beef noodle soup with tender beef, pork, pork blood jelly and fresh herbs in a fragrant lemongrass broth with braised beef ribs, tender and marinated with rich, savory flavors",$25.00 ,https://d2s742iet3d3t1.cloudfront.net/restaurants/restaurant-239219000000000000/menu/items/8/item-1300000000044373518_1729591365.jpg?size=medium,https://order.toasttab.com/online/toronto-pho-orillia/item-hue-fire-beef-rib-edition_7051802e-0149-4bac-9e41-ef1a5a012ba4
21,Coconut Milk Tea,306,Orillia,BUBBLE MILK TEAS,carbonated water / caramel color / aspartame / phosphoric acid / potassium benzoate / natural flavors / citric acid / caffeine.,,$6.50 ,https://d2s742iet3d3t1.cloudfront.net/restaurants/restaurant-239219000000000000/menu/items/8/item-1300000000044383508_1729587983.jpg?size=medium,https://order.toasttab.com/online/toronto-pho-orillia/item-coconut-milk-tea_a1a3663f-b877-4f7d-8074-7ca20ec8c132
22,Passionfruit Milk Tea,305,Orillia,BUBBLE MILK TEAS,"passion fruit juice, vodka, simple syrup, and fresh lime juice.",,$6.50 ,https://d2s742iet3d3t1.cloudfront.net/restaurants/restaurant-239219000000000000/menu/items/6/item-1300000000044383506_1729587831.jpg?size=medium,https://order.toasttab.com/online/toronto-pho-orillia/item-passionfruit-milk-tea_c2ed6cc1-0ee7-4fce-b294-6ecd2e63e06d
23,Honeydew Milk Tea,302,Orillia,BUBBLE MILK TEAS," honeydew melon, mint, lime juice, honey.",,$6.50 ,https://d2s742iet3d3t1.cloudfront.net/restaurants/restaurant-239219000000000000/menu/items/0/item-1300000000044383500_1729587281.jpg?size=medium,https://order.toasttab.com/online/toronto-pho-orillia/item-honeydew-milk-tea_791990cf-5fb2-4963-90c6-c088738e5bfc
24,Taro Milk Tea,301,Orillia,BUBBLE MILK TEAS,"Taro, sugar, coconut milk, tapioca pearls, water/",,$6.50 ,https://d2s742iet3d3t1.cloudfront.net/restaurants/restaurant-239219000000000000/menu/items/8/item-1300000000044382698_1729587126.jpg?size=medium,https://order.toasttab.com/online/toronto-pho-orillia/item-taro-milk-tea_4c9ba9ac-3b02-4b5e-b605-e5e4d5bfdf18
25,Matcha Green Tea,317,Orillia,BUBBLE MILK TEAS,matcha powder / hot water / milk / sweetener.,,$6.50 ,https://d2s742iet3d3t1.cloudfront.net/restaurants/restaurant-239219000000000000/menu/items/4/item-1300000000044383514_1729588347.jpg?size=medium,https://order.toasttab.com/online/toronto-pho-orillia/item-matcha-green-tea_c4a14f47-05db-44c6-9f80-78daadf96a90
26,Strawberry Milk Tea,304,Orillia,BUBBLE MILK TEAS, strawberries / ice / milk / sugar / vanilla extract,,$6.50 ,https://d2s742iet3d3t1.cloudfront.net/restaurants/restaurant-239219000000000000/menu/items/4/item-1300000000044383504_1729587637.jpg?size=medium,https://order.toasttab.com/online/toronto-pho-orillia/item-strawberry-milk-tea_9b5f8495-7873-4930-814f-fda80069f7c2
27,Pearls Milk Tea,312,Orillia,BUBBLE MILK TEAS,milk / tapioca / sugar / pearls,,$6.50 ,https://d2s742iet3d3t1.cloudfront.net/restaurants/restaurant-239219000000000000/menu/items/8/item-1300000000044383518_1729588631.jpg?size=medium,https://order.toasttab.com/online/toronto-pho-orillia/item-pearls-milk-tea_7ddb6fb3-39f3-440b-8fe1-2ef05f219ab3
28,Mango Milk Tea,303,Orillia,BUBBLE MILK TEAS,"mango, lime juice, mint, sugar syrup, crushed ice.",,$6.50 ,https://d2s742iet3d3t1.cloudfront.net/restaurants/restaurant-239219000000000000/menu/items/2/item-1300000000044383502_1729587460.jpg?size=medium,https://order.toasttab.com/online/toronto-pho-orillia/item-mango-milk-tea_2e70d334-bf35-470b-8468-78b575a45a9e
29,Pineapple Milk Tea,310,Orillia,BUBBLE MILK TEAS,"pineapple juice, coconut milk, rum.",,$6.50 ,https://d2s742iet3d3t1.cloudfront.net/restaurants/restaurant-239219000000000000/menu/items/2/item-1300000000044383512_1729588212.jpg?size=medium,https://order.toasttab.com/online/toronto-pho-orillia/item-pineapple-milk-tea_de7e5de2-c0cb-475b-9d11-2ade657a7a13
30,Brown Sugar MILK Tea,311,Orillia,BUBBLE MILK TEAS,sugar / tapioca,,$6.50 ,https://d2s742iet3d3t1.cloudfront.net/restaurants/restaurant-239219000000000000/menu/items/6/item-1300000000044383516_1729588500.jpg?size=medium,https://order.toasttab.com/online/toronto-pho-orillia/item-brown-sugar-milk-tea_48cd812b-78c2-4144-9568-455802f31c3d
31,Watermelon Milk Tea,307,Orillia,BUBBLE MILK TEAS,"watermelon, mint leaves, feta cheese, balsamic glaze.",,$6.50 ,https://d2s742iet3d3t1.cloudfront.net/restaurants/restaurant-239219000000000000/menu/items/0/item-1300000000044383510_1729588092.jpg?size=medium,https://order.toasttab.com/online/toronto-pho-orillia/item-watermelon-milk-tea_26670c16-27d8-46dd-8042-635f0be871d1
32,Seafood Symphony Egg Noodles,CB02,Orillia,CHICKEN/PORK BROTH NOODLE,,"Savor a bowl of springy noodles topped with shrimp, squid, and fishball in a rich, flavorful broth served with light, crispy shrimp cakes fried to golden perfection, with tender, juicy shrimp inside and a satisfying crunch in every bite",$19.00 ,https://d2s742iet3d3t1.cloudfront.net/restaurants/restaurant-239219000000000000/menu/items/0/item-1300000000044374440_1729591930.jpg?size=medium,https://order.toasttab.com/online/toronto-pho-orillia/item-seafood-symphony-egg-noodles_abe507f2-92b3-4afa-a39f-51cf9da71777
33,Shrimp & Sip Wonton Soup,CB06,Orillia,CHICKEN/PORK BROTH NOODLE,,"Enjoy plump, hand-crafted shrimp wontons in a flavorful clear broth, garnished with fresh scallions and greens for a comforting and delicious experience",$14.00 ,https://d2s742iet3d3t1.cloudfront.net/restaurants/restaurant-239219000000000000/menu/items/8/item-1300000000044374448_1729591993.jpg?size=medium,https://order.toasttab.com/online/toronto-pho-orillia/item-shrimp-sip-wonton-soup_4467c385-0a47-4b74-a9a0-abe49d4c7bdd
34,Shrimp Wonton Nest with Egg Noodles,CB05,Orillia,CHICKEN/PORK BROTH NOODLE,,"Delight in silky egg noodles topped with juicy pork and shrimp wontons, served in a rich broth with fresh herbs and crisp vegetables for a perfect flavor balance",$17.00 ,https://d2s742iet3d3t1.cloudfront.net/restaurants/restaurant-239219000000000000/menu/items/6/item-1300000000044374446_1729591977.jpg?size=medium,https://order.toasttab.com/online/toronto-pho-orillia/item-shrimp-wonton-nest-with-egg-noodles_1cea6381-f1ac-44fe-8641-b8ee5c156a46
35,Seaside Rice Noodle Soup,CB01,Orillia,CHICKEN/PORK BROTH NOODLE,,"Rice noodle soup packed with tender shrimp, squid, and fishball, served in a light, savory broth, and topped with fresh herbs and crispy garlic served with Golden, crispy fritters bursting with juicy shrimp, offering a perfect balance of crunch",$19.00 ,https://d2s742iet3d3t1.cloudfront.net/restaurants/restaurant-239219000000000000/menu/items/8/item-1300000000044374438_1729591906.jpg?size=medium,https://order.toasttab.com/online/toronto-pho-orillia/item-seaside-rice-noodle-soup_c3f04c54-7df9-408a-823b-b0ba495ae86a
36,Chill Beef Egg Noodle Stew,CB04,Orillia,CHICKEN/PORK BROTH NOODLE,,"Delight in a bowl of hủ tiếu with tender, slow-cooked beef, bathed in a savory, aromatic stew. Served over silky noodles and topped with fresh herbs, crispy shallots, and a splash of lime, this dish offers a perfect harmony of flavors and textures that will warm your ",$20.00 ,https://d2s742iet3d3t1.cloudfront.net/restaurants/restaurant-239219000000000000/menu/items/4/item-1300000000044374444_1729591963.jpg?size=medium,https://order.toasttab.com/online/toronto-pho-orillia/item-chill-beef-egg-noodle-stew_d762de07-58c3-40b6-8bc4-5ed19bef17c7
37,Stewy Beef Rice Noodle Fix,CB03,Orillia,CHICKEN/PORK BROTH NOODLE,,"Indulge in tender beef simmered to perfection in a rich, aromatic broth, served over hearty egg noodles and garnished with fresh herbs and a hint of lime for a burst of flavor in every bite",$20.00 ,https://d2s742iet3d3t1.cloudfront.net/restaurants/restaurant-239219000000000000/menu/items/2/item-1300000000044374442_1729591944.jpg?size=medium,https://order.toasttab.com/online/toronto-pho-orillia/item-stewy-beef-rice-noodle-fix_ec816214-4b7b-4ed1-bac1-bb89fc0d1504
38,VIETNAMESE ICE COFFEE,203,Orillia,COFFEE,"coffee, ice, milk, sugar /",,$6.50 ,https://d2s742iet3d3t1.cloudfront.net/restaurants/restaurant-239219000000000000/menu/items/7/item-1300000000044382187_1729584435.png?size=medium,https://order.toasttab.com/online/toronto-pho-orillia/item-vietnamese-ice-coffee_01cd3f68-cef8-4390-bd38-25f9af5bf2dc
39,VA VA VIET ICE COFFEE SLUSHIE,VVV,Orillia,COFFEE,"beef, lemongrass, garlic, ginger, fish sauce, soy sauce, rice noodles, bean sprouts, cilantro, lime /",,$6.50 ,https://d2s742iet3d3t1.cloudfront.net/restaurants/restaurant-239219000000000000/menu/items/5/item-1300000000044382185_1729584345.png?size=medium,https://order.toasttab.com/online/toronto-pho-orillia/item-va-va-viet-ice-coffee-slushie_d0c77624-4fd2-48e4-92b0-57725e4fabc2
40,COCONUT COFFEE,380,Orillia,COFFEE,"coffee, coconut milk, cocoa powder, sugar.",,$6.50 ,https://d2s742iet3d3t1.cloudfront.net/restaurants/restaurant-239219000000000000/menu/items/3/item-1300000000044382183_1729584221.png?size=medium,https://order.toasttab.com/online/toronto-pho-orillia/item-coconut-coffee_7a2b8e5b-05cb-4aca-8a27-53a82fbc159a
41,Shrimp Fried Rice,FR01,Orillia,FRIED RICE,,"Our unique Shrimp Fried Rice, featuring high-quality jasmine rice, succulent shrimp, fresh peas, carrots, and scrambled eggs, for a Vietnamese-style flavorful satisfaction",$19.00 ,https://d2s742iet3d3t1.cloudfront.net/restaurants/restaurant-239219000000000000/menu/items/6/item-1300000000044380276_1729587570.jpg?size=medium,https://order.toasttab.com/online/toronto-pho-orillia/item-shrimp-fried-rice_78450d21-81a5-4840-a46d-933e3cada072
42,Crispy Garlic Chicken Fried Rice,FR04,Orillia,FRIED RICE,,"Relish a delicious plate of fried rice stir-fried with juicy chicken thighs, perfectly sautéed garlic, and a hint of sweetness from honey. This dish combines savory and sweet flavors, creating a satisfying meal that will tantalize your taste bud",$20.00 ,https://d2s742iet3d3t1.cloudfront.net/restaurants/restaurant-239219000000000000/menu/items/2/item-1300000000044380282_1729587628.jpg?size=medium,https://order.toasttab.com/online/toronto-pho-orillia/item-crispy-garlic-chicken-fried-rice_4978ffa8-08d3-410d-904f-681225e31182
43,Chicken Fried Rice,FR02,Orillia,FRIED RICE,,"Heavenly dish, cooked in our wok with succulent pieces of chicken mingled together with vibrant carrots and sweet peas",$19.00 ,https://d2s742iet3d3t1.cloudfront.net/restaurants/restaurant-239219000000000000/menu/items/8/item-1300000000044380278_1729587586.jpg?size=medium,https://order.toasttab.com/online/toronto-pho-orillia/item-chicken-fried-rice_4ca38a91-8f0c-4815-99c1-7753d12bd1af
44,Seafood Fried Rice,FR03,Orillia,FRIED RICE,,"Combination fried rice, a sensational dish made with freshly cooked shrimp, squid, fishball, imitation crabmeat and egg combined with tender carrots and juicy peas. A delightful treat that can be enjoyed as its own meal or an accompaniment to any of your culinary creations!",$20.00 ,https://d2s742iet3d3t1.cloudfront.net/restaurants/restaurant-239219000000000000/menu/items/0/item-1300000000044380280_1729587601.jpg?size=medium,https://order.toasttab.com/online/toronto-pho-orillia/item-seafood-fried-rice_f0e79fe2-63b1-4698-9f49-8a0ef94ba5a8
45,Cube Beef Fried Rice,FR05,Orillia,FRIED RICE,,"Indulge your taste buds with the amazing flavours of Bò Lúc Lắc, an iconic Vietnamese beef stir fry. This scrumptious dish features cubes of marinated beef cooked in a zesty and sweet sauce accompanied by sauteed onions and peppers to provide irresistible flavour - This dish comes with a side of white rice for an unforgettable culinary journey to Vie",$20.00 ,https://d2s742iet3d3t1.cloudfront.net/restaurants/restaurant-239219000000000000/menu/items/4/item-1300000000044380284_1729587655.jpg?size=medium,https://order.toasttab.com/online/toronto-pho-orillia/item-cube-beef-fried-rice_7a3ead8b-f89f-4177-a40b-46726119d99b
46,Combination Fried Rice,FR06,Orillia,FRIED RICE,,"Indulge in our Vietnamese-style combination fried rice, a sensational dish made with freshly cooked chicken, sausage, pork and egg combined with tender carrots and juicy peas",$20.00 ,https://d2s742iet3d3t1.cloudfront.net/restaurants/restaurant-239219000000000000/menu/items/6/item-1300000000044380286_1729587670.jpg?size=medium,https://order.toasttab.com/online/toronto-pho-orillia/item-combination-fried-rice_1df342e4-3143-4972-a8dd-ca4b3cc396e0
47,Lemon Queen with Aloe Vera,507,Orillia,FRUIT TEAS,lemon juice / simple syrup / club soda / lemon slices / mint leaves / crushed ice,,$8.50 ,https://d2s742iet3d3t1.cloudfront.net/restaurants/restaurant-239219000000000000/menu/items/1/item-1300000000044383991_1729590758.jpg?size=medium,https://order.toasttab.com/online/toronto-pho-orillia/item-lemon-queen-with-aloe-vera_2f51ba66-f84d-49dc-b7d5-1c645a1343d7
48,Strawberry Lover,504,Orillia,FRUIT TEAS,strawberries/cream/ice cream/sugar/milk/vanilla extract.,,$8.50 ,https://d2s742iet3d3t1.cloudfront.net/restaurants/restaurant-239219000000000000/menu/items/7/item-1300000000044383987_1729590608.jpg?size=medium,https://order.toasttab.com/online/toronto-pho-orillia/item-strawberry-lover_f6398ceb-96fa-4918-b7f4-f4500f88e905
49,Fruit Addict,508,Orillia,FRUIT TEAS,strawberries/mangoes/pineapples/blueberries/banana slices/orange juice/apple juice/ice cubes,,$8.50 ,https://d2s742iet3d3t1.cloudfront.net/restaurants/restaurant-239219000000000000/menu/items/3/item-1300000000044383993_1729590823.jpg?size=medium,https://order.toasttab.com/online/toronto-pho-orillia/item-fruit-addict_4f1cfcfc-edd5-4477-8de2-6939c54d2096
50,Grapefruit Green Tea with Aloe Vera,506,Orillia,FRUIT TEAS,"grapefruit, tea leaves.",,$8.50 ,https://d2s742iet3d3t1.cloudfront.net/restaurants/restaurant-239219000000000000/menu/items/9/item-1300000000044383989_1729590684.jpg?size=medium,https://order.toasttab.com/online/toronto-pho-orillia/item-grapefruit-green-tea-with-aloe-vera_7d389c25-8a68-4f91-aede-1572a0db295e
51,Mango Green Tea,501,Orillia,FRUIT TEAS,mango puree/sugar/water/ice/black tea bag.,,$8.50 ,https://d2s742iet3d3t1.cloudfront.net/restaurants/restaurant-239219000000000000/menu/items/1/item-1300000000044383981_1729590219.jpg?size=medium,https://order.toasttab.com/online/toronto-pho-orillia/item-mango-green-tea_61c3d95c-2fea-443f-8499-bedc811e266b
52,Passion Fruit Green Tea,502,Orillia,FRUIT TEAS,fruit tea blend / filtered water / ice / optional sweetener,,$8.50 ,https://d2s742iet3d3t1.cloudfront.net/restaurants/restaurant-239219000000000000/menu/items/3/item-1300000000044383983_1729590298.jpg?size=medium,https://order.toasttab.com/online/toronto-pho-orillia/item-passion-fruit-green-tea_e2ec273c-0f80-4e01-9af3-c245f1cc2d03
53,Fresh Peach Tea,503,Orillia,FRUIT TEAS,"black tea, peach flavoring, water, and sugar./",,$8.50 ,https://d2s742iet3d3t1.cloudfront.net/restaurants/restaurant-239219000000000000/menu/items/5/item-1300000000044383985_1729590521.jpg?size=medium,https://order.toasttab.com/online/toronto-pho-orillia/item-fresh-peach-tea_04c66a49-3f59-4d4d-ad60-9bb713fa13e3
54,Shrimp Pad Thai,PT01,Orillia,PAD THAI,,"Indulge in our Vietnamese-style combination fried rice, a sensational dish made with freshly cooked chicken, sausage, pork and egg combined with tender carrots and juicy peas",$19.00 ,https://d2s742iet3d3t1.cloudfront.net/restaurants/restaurant-239219000000000000/menu/items/5/item-1300000000044381225_1729587989.jpg?size=medium,https://order.toasttab.com/online/toronto-pho-orillia/item-shrimp-pad-thai_c1a08814-0635-42ad-9a7d-503cde0eb9c6
