#,Menu_Item,SKU,Location,Category,Ingredients,Description,Price,Image,Order Online
110,Stir Fried Crispy Egg Noodle with Meat and Seafood,SF02,Orillia,STIR FRIED,,"Dig into our delicious wok-tossed noodle dish and savor each mouthwatering bite! Succulent pieces of beef, chicken, pork and shrimp team up with sweet mussels, flavorful imitation crabmeat and bouncy fish balls to create a flavor sensation. Complemented by a colorful selection of seasonal vegetables including baby corn for crunchy perfection - this delectable entree is guaranteed to please your palate every time!*Seasonal seafood ingredients so vary; availability subject to change.",$20.00 ,https://d2s742iet3d3t1.cloudfront.net/restaurants/restaurant-239219000000000000/menu/items/4/item-1300000000044381534_1729588367.jpg?size=medium,https://order.toasttab.com/online/toronto-pho-orillia/item-stir-fried-crispy-egg-noodle-with-meat-and-seafood_a768c546-f09d-4d30-ab4d-40c9947e566e
111,Grilled Chicken on Vermicelli,VM01A,Orillia,VERMICELLI,,,$18.00 ,https://d2s742iet3d3t1.cloudfront.net/restaurants/restaurant-239219000000000000/menu/items/6/item-1300000000044379366_1729586957.jpg?size=medium,https://order.toasttab.com/online/toronto-pho-orillia/item-grilled-chicken-on-vermicelli_c3b715a1-4ac1-4d29-b4d2-025dfb5639f3
112,Grilled Beef and Spring Roll on Vermicelli,VM04B,Orillia,VERMICELLI,,"Tender grilled beef paired with a crispy spring roll, served over vermicelli rice noodles with fresh herbs, Vietnamese pickled daikon and carrots, crisp lettuce, and a side of fish sauce",$20.00 ,https://d2s742iet3d3t1.cloudfront.net/restaurants/restaurant-239219000000000000/menu/items/6/item-1300000000044379386_1729587180.jpg?size=medium,https://order.toasttab.com/online/toronto-pho-orillia/item-grilled-beef-and-spring-roll-on-vermicelli_27ce652f-1474-48d2-9164-4850ac84daaa
113,Grilled Beef on Vermicelli,VM04A,Orillia,VERMICELLI,,"Treat yourself to a delicious plate of our marinated grilled beef and savory vermicelli rice noodles. Accented with crisp, refreshing herbs, pickled veggies, and lettuce for the perfect balance in flavor",$20.00 ,https://d2s742iet3d3t1.cloudfront.net/restaurants/restaurant-239219000000000000/menu/items/4/item-1300000000044379384_1729587161.jpg?size=medium,https://order.toasttab.com/online/toronto-pho-orillia/item-grilled-beef-on-vermicelli_2877d040-c1dc-4d57-b209-fe5fbecdad2f
114,Grilled Shrimp and Spring Roll on Vermicelli,VM03B,Orillia,VERMICELLI,,"Juicy grilled shrimp and a crispy spring roll served over vermicelli rice noodles with fresh herbs, Vietnamese pickled daikon and carrots, crisp lettuce, and a side of fish sauce.",$19.00 ,https://d2s742iet3d3t1.cloudfront.net/restaurants/restaurant-239219000000000000/menu/items/0/item-1300000000044379380_1729587126.jpg?size=medium,https://order.toasttab.com/online/toronto-pho-orillia/item-grilled-shrimp-and-spring-roll-on-vermicelli_9f031eb7-a107-47e8-8f44-95313e3ce23c
115,Grilled Beef and Shrimp on Sugar Cane on Vermicelli,VM04C,Orillia,VERMICELLI,,"Tender grilled beef paired with juicy Vietnamese shrimp on sugar cane, served over vermicelli rice noodles with fresh herbs, Vietnamese pickled daikon and carrots, crisp lettuce, and a side of fish sauce.",$21.00 ,https://d2s742iet3d3t1.cloudfront.net/restaurants/restaurant-239219000000000000/menu/items/8/item-1300000000044379388_1729587200.jpg?size=medium,https://order.toasttab.com/online/toronto-pho-orillia/item-grilled-beef-and-shrimp-on-sugar-cane-on-vermicelli_a5b7cdaa-a330-4077-9ac8-c5896153388d
116,Grilled Shrimp and Shrimp on Sugar Cane on Vermicelli,VM03C,Orillia,VERMICELLI,,"Savor perfectly grilled shrimp alongside juicy Vietnamese shrimp on sugar cane, all served over vermicelli rice noodles with fresh herbs, Vietnamese pickled daikon and carrots, crisp lettuce, and a side of fish sauce",$20.00 ,https://d2s742iet3d3t1.cloudfront.net/restaurants/restaurant-239219000000000000/menu/items/2/item-1300000000044379382_1729587143.jpg?size=medium,https://order.toasttab.com/online/toronto-pho-orillia/item-grilled-shrimp-and-shrimp-on-sugar-cane-on-vermicelli_98e3cbc0-e247-401e-b240-a14d0e9484db
117,Grilled Shrimp on Vermicelli,VM03A,Orillia,VERMICELLI,,,$19.00 ,https://d2s742iet3d3t1.cloudfront.net/restaurants/restaurant-239219000000000000/menu/items/8/item-1300000000044379378_1729587107.jpg?size=medium,https://order.toasttab.com/online/toronto-pho-orillia/item-grilled-shrimp-on-vermicelli_0f8cbe9c-57eb-4321-9851-0636163de9ca
118,Grilled Pork and Shrimp on Sugar Cane on Vermicelli,VM02C,Orillia,VERMICELLI,,"Flavorful grilled pork and juicy Vietnamese shrimp on sugar cane, served over vermicelli rice noodles with fresh herbs, Vietnamese pickled daikon and carrots, crisp lettuce, and a side of fish sauce.",$19.00 ,https://d2s742iet3d3t1.cloudfront.net/restaurants/restaurant-239219000000000000/menu/items/6/item-1300000000044379376_1729797722.jpg?size=medium,https://order.toasttab.com/online/toronto-pho-orillia/item-grilled-pork-and-shrimp-on-sugar-cane-on-vermicelli_f3ff2e7c-db2c-4274-a6f9-f1c6d38d9ef5
119,Grilled Pork and Spring Roll on Vermicelli,VM02B,Orillia,VERMICELLI,,"Juicy grilled pork and a crispy spring roll on a bed of vermicelli rice noodles, served with fresh herbs, Vietnamese pickled daikon and carrots, crisp lettuce, and a side of fish sauce.",$18.00 ,https://d2s742iet3d3t1.cloudfront.net/restaurants/restaurant-239219000000000000/menu/items/4/item-1300000000044379374_1729797701.jpg?size=medium,https://order.toasttab.com/online/toronto-pho-orillia/item-grilled-pork-and-spring-roll-on-vermicelli_4d57bdd2-c4b0-4639-83aa-661f2dc21a79
120,Grilled Pork on Vermicelli,VM02A,Orillia,VERMICELLI,,"Indulge in perfectly grilled pork, marinated with garlic, shallots, and lemongrass. Served on vermicelli noodles with crisp cucumbers, fresh herbs, pickled carrot & daikon, peanuts, and flavorful fish sauce",$18.00 ,https://d2s742iet3d3t1.cloudfront.net/restaurants/restaurant-239219000000000000/menu/items/2/item-1300000000044379372_1729587041.jpg?size=medium,https://order.toasttab.com/online/toronto-pho-orillia/item-grilled-pork-on-vermicelli_9a0d0258-459b-4ae1-b572-db8bcd7f45bf
121,Grilled Chicken and Shrimp on Sugar Cane on Vermicelli,VM01C,Orillia,VERMICELLI,,"Tender grilled chicken and juicy Vietnamese sugar cane shrimp on vermicelli rice noodles, served with fresh herbs, Vietnamese pickled daikon and carrots, crisp lettuce, and a side of fish sauce.",$19.00 ,https://d2s742iet3d3t1.cloudfront.net/restaurants/restaurant-239219000000000000/menu/items/0/item-1300000000044379370_1729587022.jpg?size=medium,https://order.toasttab.com/online/toronto-pho-orillia/item-grilled-chicken-and-shrimp-on-sugar-cane-on-vermicelli_bb133560-38a3-4fba-9663-6d68fb2d7990
122,Grilled Chicken and Spring Roll on Vermicelli,VM01B,Orillia,VERMICELLI,,"Tender, marinated grilled chicken on vermicelli rice noodles, served with a crispy spring roll, fresh herbs, Vietnamese pickled daikon and carrots, crisp lettuce, and a side of fish sauce.",$18.00 ,https://d2s742iet3d3t1.cloudfront.net/restaurants/restaurant-239219000000000000/menu/items/8/item-1300000000044379368_1729586997.jpg?size=medium,https://order.toasttab.com/online/toronto-pho-orillia/item-grilled-chicken-and-spring-roll-on-vermicelli_828ddc87-43c0-48a1-a89b-5edce14ec534
